firm_name,firm_motor,star_rating,firm_rev,service_pct(%),platform_pct(%),firm_price,firm_employee,year_founded,firm_location
SPEC INDIA,"Enterprise Software, Mobility & BI Solutions",4.8,26,20,15,< $25/hr ,250 - 999,1987,"India, United States "
instinctools,Delivering the future. Now.,4.8,8,5,10,$50 - $99/hr ,250 - 999,2000,"United States, Germany "
SoluLab,Blockchain | IoT | Mobility | AI | Big Data,5.0,32,15,15,$25 - $49/hr ,50 - 249,2014,"United States, India "
ELEKS,Your Technology Partner for Software Innovation,5.0,3,10,20,$25 - $49/hr ,"1,000 - 9,999",1991,"Estonia, United States "
Sigma Data Systems,Discover the world of Big Data with us!,4.7,5,40,10,$25 - $49/hr ,250 - 999,2010,"United States, Australia "
NeenOpal Inc.,The Hub Of Data Science Innovation,5.0,5,25,10, $25 - $49/hr ,10 - 49,2016,"United States, India "
CodeCompletePro,IT Outsourcing Services,5.0,1,20,5,$50 - $99/hr ,10 - 49,2021,"United States, Philippines "
Consagous Technologies,Helping brands by being their Technology Partner,4.8,32,10,20,$25 - $49/hr ,50 - 249,2008,"India, United States "
NEX Softsys,IT Partner for Global Clients,5.0,12,20,20,$25 - $49/hr ,50 - 249,2003,United States 
Beyond Key,IT Consulting and Software Development Services ,5.0,7,20,10,$25 - $49/hr ,250 - 999,2005,"United States, India "
Datapine,BUSINESS INTELLIGENCE MADE EASY,5.0,3,90,5,$50 - $99/hr ,10 - 49,2012,Germany 
Dataforest,Data Engineering and Web Product Development,5.0,4,30,20,$50 - $99/hr ,50 - 249,2018,"Ukraine, Estonia "
pwrteams,Scale your enterprise with cross-border teams,4.9,7,10,25,$25 - $49/hr ,250 - 999,2008,"Luxembourg, Poland "
Intellias,Global Technology Partner,5.0,5,15,5,$25 - $49/hr ,"1,000 - 9,999",2002,"Ukraine, United States "
Altar.io,Product & Software Development Agency,5.0,9,25,10,$50 - $99/hr ,10 - 49,2015,"Portugal, United Kingdom "
Huspi,Transforming ideas into user-friendly software.,5.0,6,10,50,$50 - $99/hr ,10 - 49,2015," Poland, Ukraine "
Rudder Analytics,Steering Your Business.,4.8,3,90,5,$25 - $49/hr ,10 - 49,2015,India 
Fayrix,Remote software teams & services for startups. ,5.0,8,10,5,< $25/hr ,"1,000 - 9,999",2005,Israel 
Accubits,Your Technology Partner- Simple. Seamless. Secure,4.9,7,10,10,$25 - $49/hr ,50 - 249,2012,"India, United States "
OrbitSoft,We do software right,4.9,3,5,20,$25 - $49/hr ,50 - 249,2001,United States 
Broscorp,Delivering software that helps businesses to grow,4.9,4,10,50,$25 - $49/hr ,10 - 49,2016,Ukraine 
Clustox,The House of Innovation,5.0,5,10,25,< $25/hr ,10 - 49,2012,Pakistan 
VITech,Software development powerhouse,5.0,3,30,25,$50 - $99/hr ,50 - 249,2007,Ukraine 
GFAIVE,Demand forecasting for Fashion Retail,5.0,2,20,25,NA ,10 - 49,2018,Georgia 
SPRYTE Labs,"The right team, every time",5.0,3,10,10,NA ,"1,000 - 9,999",2019,United States 
abstractR,We make Abstract ideas Real,5.0,2,20,20,$50 - $99/hr ,10 - 49,2018,Czech Republic 
SetuServ,Customized AI: Machine Power + Human Accuracy,5.0,1,50,16,NA ,50 - 249,2012,"United States, India "
InData Labs,Big on Data Science and AI,5.0,1,30,30,$50 - $99/hr ,50 - 249,2014,"Cyprus, Singapore "
Aegis Soft Tech,Software Development Expert,5.0,2,5,25,$25 - $49/hr ,50 - 249,2003,India 
AM-BITS,Time to rethink IT,5.0,2,20,10,$50 - $99/hr ,50 - 249,2016,Ukraine 
ScaleupAlly,Scaleup the development of your Business Idea,4.8,3,30,30,$25 - $49/hr ,10 - 49,2017,India 
ThirdEye Data Inc.,Transforming Enterprises with AI Applications,5.0,1,20,10,$50 - $99/hr ,50 - 249,2010,United States 
CodeCoda Ltd,Advanced Software Development Outsourcing,3.0,2,10,15,$25 - $49/hr ,50 - 249,2016,"Bulgaria, Ireland "
S-PRO,Strategic partner.,5.0,30,10,25,$50 - $99/hr ,50 - 249,2014,Poland 
Welby Consulting,The Future of Digital,3.4,5,10,50,$100 - $149/hr ,2 - 9,2015,Canada 
WebClues Infotech,"Your Vision, Our Creation",4.6,15,5,50, $25 - $49/hr ,50 - 249,2014,Canada 
MobiDev,"Web and Mobile development, AI apps",5.0,16,10,10,$50 - $99/hr ,250 - 999,2009,United States 
Prismetric,Delivering Quality Products and Premium Services,4.7,14,5,50,< $25/hr ,50 - 249,2008,"India, United States "
Sunflower Lab,Sunflower Lab,4.9,13,5,50,$50 - $99/hr ,50 - 249,2010,United States 
Idealogic,Custom software development for startups,5.0,14,10,20,$25 - $49/hr ,50 - 249,2016,"Poland, Canada "
Clavax Technologies LLC,Transform Your Ideas into Digital Solutions,4.4,15,10,10,$25 - $49/hr ,50 - 249,2011,United States 
APPSTIRR,Award Winning App Development Company,5.0,14,5,20,$25 - $49/hr ,50 - 249,2010,"United States, United Arab Emirates "
Classic Informatics,The Digital Innovation Company,4.9,13,20,20,$25 - $49/hr ,50 - 249,2002,"India, United Kingdom "
OpenGeeksLab,Crafting software that works for you.,5.0,12,10,30,$25 - $49/hr ,50 - 249,2015,Ukraine 
HQSoftware,"IoT, AR, VR, and custom software development",4.9,12,5,25,$25 - $49/hr ,50 - 249,2001,"United States, Georgia "
TrendLine Global,Custom Software Development Company ,5.0,11,5,25,$25 - $49/hr ,50 - 249,2010,"Ukraine, United Kingdom "
DigiPrima Technologies Pvt. Ltd.,Trusted Partners for Software Solutions,5.0,11,10,20,< $25/hr ,10 - 49,2016,"India, United States "
BR Softech Pvt Ltd,Website & Mobile Apps Development Company,4.5,10,5,50,$25 - $49/hr ,"1,000 - 9,999",2012,United States 
Exceed Team,Exceeding expectations of our clients,5.0,5,5,100,$25 - $49/hr ,50 - 249,2013,Russia  
Inoxoft,"IEC/ISO 27001, Google, Microsoft Certified Company",5.0,9,10,10,$25 - $49/hr ,50 - 249,2014,Ukraine 
Maxilect,"Martech, Ad Tech, Fintech, Blockchain",5.0,8,20,20,$50 - $99/hr ,50 - 249,2015,Russia 
Burning Buttons LLC,Digital boost for your business to succeed!,5.0,6,10,50,$25 - $49/hr ,50 - 249,2009,Turkey 
Systango Technologies,"We Make the Impossible, Possible!",5.0,6,10,50,$25 - $49/hr ,250 - 999,2007,United Kingdom 
Noventum Custom Software Development Company,Custom Software & Web Development in New Mexico,5.0,3,20,100,$100 - $149/hr ,2 - 9,2012,United States 
Napollo Software Design L.L.C,Best Software Design Agency in Dubai & New York,5.0,7,20,20,NA ,50 - 249,2011,United States 
SemiDot Infotech Pvt Ltd,Right Technology Partner for IT Solutions,4.7,7,10,30,< $25/hr ,50 - 249,2011,"United States, India "
Sphinx Solutions,Inspire : Innovate : Evolve,4.6,8,5,10,< $25/hr ,Freelancer,2010,"India, United States "
Redian Software,Delivering Open Source Solutions,5.0,5,10,50,$25 - $49/hr ,10 - 49,2016,"United Kingdom, India "
Indus Net Technologies,We Deliver Digital Success,5.0,5,10,50,< $25/hr ,250 - 999,1997,"India, United Kingdom "
RWaltz Group Inc.,Blockchain Solutions Experts,5.0,5,10,50,$50 - $99/hr ,50 - 249,2000,United States 
UNL Solutions,"Dedicated Team, Dedicated Developer",4.3,3,10,100,$25 - $49/hr ,50 - 249,2006,"United Kingdom, Belarus "
Shockoe,Mobile by Design,5.0,2,5,100,$100 - $149/hr ,10 - 49,2010,United States 
Decipher Zone Technologies Pvt Ltd,Java Development Company,5.0,2,5,100,< $25/hr ,50 - 249,2015,India 
Stellen Infotech,You Think We Create,5.0,2,2,100,$25 - $49/hr ,50 - 249,2010,"India, United States "
N-iX,Software development company,5.0,5,20,25,$50 - $99/hr ,"1,000 - 9,999",2002,"Malta, Ukraine "
Build Scale Prosper,Build. Scale. Prosper. ,5.0,1,25,100,$100 - $149/hr ,2 - 9,2018,United States 
DreamzTech Solutions Inc.,"Digital Partner for Web, Mobile & IoT Solutions",5.0,4,10,50,< $25/hr ,50 - 249,2013,"United Kingdom, United States "
NIX,"Enterprise Software, Data Analytics & BI Solutions",5.0,6,10,10,$50 - $99/hr ,"1,000 - 9,999",1994,United States 
InnovationM,End to End Technology Solutions,4.4,4,20,50,< $25/hr ,50 - 249,2010,"United States, India "
Fortunesoft IT Innovations,High-end software product engineering & services,5.0,4,5,50,$25 - $49/hr ,50 - 249,2009,"United States, India "
Prakash Software Solutions Pvt Ltd,Smart Technology Provider,4.8,5,2,35,$25 - $49/hr ,50 - 249,2000,India 
Loginworks Softwares Inc,"Team you will Like, Trust and Admire",5.0,3,25,50,< $25/hr ,50 - 249,2006,"India, United States "
Bacancy Technology,Full Stack Agile & Lean Development Partner,4.8,5,10,25,$25 - $49/hr ,250 - 999,2011,"India, Canada "
SumatoSoft,We help companies to digitalize their businesses.,5.0,5,10,20,$50 - $99/hr ,50 - 249,2012,United States 
"Zymr, Inc.",Accelerate Cloud-Native Agile Development,5.0,1,5,100,$25 - $49/hr ,50 - 249,2012,"United States, Australia "
Golden Logic Company for Communications and Information Technology,"IT, Applications, VR/AR System Integration Banking",5.0,1,5,100,NA ,10 - 49,2017,"Saudi Arabia, United Arab Emirates "
4ire Labs,"Create winning experience in Blockchain, DeFi ",5.0,3,10,50,$25 - $49/hr ,250 - 999,2010,"Ukraine, Estonia "
JDV Technologies,Cloud Consulting and Software Development Company ,4.9,5,10,10,$25 - $49/hr ,10 - 49,2018,"India, United States "
Ballard Chalmers,"software, engineered",5.0,5,5,10,$100 - $149/hr ,10 - 49,2005,United Kingdom 
Queppelin,Metaverse - AR | VR | NFTs | AI | WebAR | 3D,5.0,5,5,10,< $25/hr ,50 - 249,2010,United States 
Plaxonic Technologies,Invent | Innovative,5.0,4,10,25,$25 - $49/hr ,50 - 249,2013,"India, United States "
TemaBit,Keep it smart and simple!,4.9,4,10,25,$25 - $49/hr ,250 - 999,2013,"Ukraine, United States "
Binariks Inc,Software Development Company,5.0,4,5,25,$50 - $99/hr ,50 - 249,2014,"Ukraine, United States "
Serokell,"YOUR EXPECTATIONS, LIFTED.",5.0,4,20,10,$50 - $99/hr ,50 - 249,2015,Estonia 
Space-O Technologies,"[Mobile, Web, BigData, Ruby, Python Expert]",4.9,4,10,20,$25 - $49/hr ,50 - 249,2010,"India, Canada "
DIGIS,Software Development,5.0,2,50,25,$25 - $49/hr ,50 - 249,2009,Ukraine 
DOIT Software,"Mobile Apps, Software Development & Staffing",5.0,4,5,20,$25 - $49/hr ,10 - 49,2014,"Ukraine, United Kingdom "
SKY INCOM,Web & Mobile Development,5.0,4,5,20,$25 - $49/hr ,10 - 49,2002,Belarus 
Miquido,Full-service software development partner,4.9,4,20,10,$50 - $99/hr ,250 - 999,2011,Poland 
The Analyst Agency,"Web Developers in Buffalo, NY",5.0,1,30,50,NA ,Freelancer,,"United States, India "
ALFATEK,"IT MSP, Software Development, Solution, IT Service",5.0,3,5,25,$100 - $149/hr ,2 - 9,2013,United States 
Imenso Software,Full Stack Tech Consulting Agency,5.0,3,10,20,$25 - $49/hr ,50 - 249,2010,India 
Pitangent,Easing productivity with digital innovations,5.0,3,10,20,< $25/hr ,10 - 49,2017,India 
Maticz Technologies,"Web3, Metaverse & Blockchain Development Company",5.0,3,10,20,$25 - $49/hr ,50 - 249,2020,India 
Damco Solutions,Enabling Business Transformation and Innovation,4.9,3,5,25,NA ,"1,000 - 9,999",1996,United States 
Synergo Group,We Build Effective Solutions,5.0,1,20,50,$25 - $49/hr ,10 - 49,2005,Canada 
Advanced Software Development (ASD Ltd),Custom Software Development Company,5.0,1,20,50,$25 - $49/hr ,50 - 249,2007,Ukraine 
Whitecap Canada,Reimagine Your Business,5.0,1,15,50,< $25/hr ,10 - 49,1997,Canada 
Teksmobile,1500+ Mobile Apps Delivered Over 15+ Years,5.0,1,10,50,$25 - $49/hr ,50 - 249,2006,"Australia, India "
Jellyfish Technologies,Transforming ideas into applications,5.0,2,5,30,$25 - $49/hr ,50 - 249,2011,India 
JetSoftPro,Agility. Performance. Scale.,4.8,1,10,50,$25 - $49/hr ,50 - 249,2003,United States 
Focaloid Technologies,Digital Solutions. Simplified.,5.0,2,10,25,$25 - $49/hr ,50 - 249,2012,"India, United States "
Hiteshi,Top Mobile & Web Development Company,5.0,2,10,25,$25 - $49/hr ,50 - 249,2006,"India, Australia "
Techmango Technology Services Private Limited,Best Offshore Software Development Company ,4.3,3,10,20,< $25/hr ,250 - 999,2014," India, United States "
Evolve Technologies,IT agency,4.8,1,30,30,$50 - $99/hr ,10 - 49,2000,Ireland 
Virtual Electronics PTE LTD,Software and mobile app development in Singapore,5.0,2,5,25,$25 - $49/hr ,10 - 49,2019,Singapore 
Reenbit,Intelligent engineering & beyond ,5.0,3,5,5,$25 - $49/hr ,50 - 249,2018,"Ukraine, Poland "
Michigan Software Labs,We Make Apps,5.0,2,10,20,$150 - $199/hr ,10 - 49,2010,United States 
Starkflow,#1 platform for hiring SaaS talent globally.,5.0,2,10,20,$100 - $149/hr ,10 - 49,2017,"United States, Ukraine "
ExpertsFromIndia,We Make IT Possible,5.0,2,2,25,$25 - $49/hr ,250 - 999,2003,"United States, India "
Volumetree,Impact Through Technology,5.0,2,20,10,$25 - $49/hr ,50 - 249,2017,"India, South Africa "
QuadLogix Technologies Pvt. Ltd.,Next-Gen Technology Solutions ,5.0,2,5,20,$25 - $49/hr ,10 - 49,2009,"India, United Arab Emirates "
WOXAPP,Mobile applications for startups and businesses ,5.0,2,5,20,$25 - $49/hr ,10 - 49,2011,Ukraine 
ISS Art,It’s your chance to break new ground in business!,5.0,2,10,15,$25 - $49/hr ,50 - 249,2003,"Russia, United States "
47Billion,Data Analytics | UXUI | Product Development | ML ,5.0,1,40,9,< $25/hr ,50 - 249,2012,"United States, India "
Talentelgia Technologies Private Limited,Transforming ideas into innovations,5.0,2,10,12,< $25/hr ,50 - 249,2012,"India, United Kingdom "
Visichain,Accelerate your digital procurement transformation,4.8,1,30,20,NA  ,50 - 249,2015,China 
Endion IT,Web & Mobile App Development,5.0,1,10,30,$25 - $49/hr ,10 - 49,2017,Argentina 
Programmers.io,Your Extended Software Development Team,5.0,1,10,30,$25 - $49/hr ,250 - 999,2013,"United States, India "
Intetics Inc.,Where Software Concepts Come Alive™,5.0,1,15,25,$50 - $99/hr ,250 - 999,1995,"United States, Germany "
Jevera,SOFTWARE SOLUTIONS FOR COMPLICATED BUSINESS TASKS,4.8,1,40,5,$50 - $99/hr ,50 - 249,2009,Ukraine 
Innuy - Full Stack Development,Innuy - Full Stack Development,4.8,1,20,20,NA ,10 - 49,2012,Uruguay 
Web And SEO Pro,Web Design And Development Services,5.0,1,6,26,$50 - $99/hr ,50 - 249,2015,United States 
Pentation Analytics,We provide analytical services to BFSI industry,0.0,0,100,70,$50 - $99/hr ,10 - 49,2015,United States 
ITXITPRO PVT. LTD.,Unleash The Digital Dynamics,5.0,1,10,20,< $25/hr ,10 - 49,2014,India 
Softura,Enabling Innovation in a Business 4.0 World,5.0,1,10,20,$100 - $149/hr ,250 - 999,1997,"United States, India "
ConvergeSol,Solutions Focused On Your Business,5.0,1,10,20,$25 - $49/hr ,10 - 49,2010,"United States, India "
Oneskai,Digitally Transform Your Business,5.0,1,10,20,$25 - $49/hr ,10 - 49,2021,India 
Chetu,World Class Software Solutions,5.0,1,5,20,$25 - $49/hr ,"1,000 - 9,999",2000,"United States, Netherlands "
Miri Infotech,Top 1% Talent at an Unbeatable Price,4.8,1,5,20,< $25/hr ,250 - 999,2003,"United States, India "
BairesDev,Powered by Technology. Driven by Talent.,5.0,1,5,10,$25 - $49/hr ,"1,000 - 9,999",2009,"United States, Argentina "
Avenga,Transforming Industries,4.0,1,10,20,$50 - $99/hr ,"1,000 - 9,999",2019,"United States, Germany "
WebDataGuru,Web Data Extraction and Scraping Services,0.0,0,100,40,< $25/hr ,50 - 249,2015,"United States, United Kingdom "
Analytist,Advancing your insightful decisions,0.0,0,100,30,$50 - $99/hr ,2 - 9,2019,Thailand 
ima appweb,"Increased Awareness, Higher Visibility",0.0,0,10,100,$25 - $49/hr ,10 - 49,2011,India 
Carter Point,Aiding IT brands gain traction in local markets.,0.0,0,10,100,< $25/hr ,2 - 9,2015,Estonia 
MIRAKI TECHNOLOGIES,MIRACLES HAPPEN HERE,0.0,0,10,100,$100 - $149/hr ,50 - 249,2015,India  
Clairvoyant LLC,We power Digital Disruption,0.0,0,70,50,$50 - $99/hr ,50 - 249,2012,United States 
XLENT TECHNOLOGIES,"web, ios, android, chatbot, wordpress, magento2",0.0,0,5,100,$100 - $149/hr ,10 - 49,2017,United States 
SunTec Data,Turn Data Into Sight,0.0,0,100,20,NA ,250 - 999,,"United States, India "
3i Data Scraping Services,Enterprise Web/Mobile App Data Scraping!,0.0,0,100,20,NA ,50 - 249,2009,"United States, Germany "
Precognox,Precognox is a high-end consulting firm,0.0,0,60,50,NA ,50 - 249,2008,Hungary 
SEVEN,The Company That Exceeds Your Expectations,0.0,0,6,80,$25 - $49/hr ,50 - 249,2007,Ukraine 
FreshDataLabs,Getting the leads has never been this easy,0.0,0,50,40,$50 - $99/hr ,10 - 49,2018,India 
HTML Pro,NYC’s Top IT Solutions & Digital Agency,1.0,1,10,30,$50 - $99/hr ,50 - 249,2013,United States 
Juice analytics,Serve up your data the way customers need it,0.0,0,70,20,$50 - $99/hr ,10 - 49,2004,United States 
Salpo Technologies,Listen. Learn. Innovate.,0.0,0,30,50,NA ,50 - 249,2007,United Kingdom 
Dataentryindia.in,IT Outsourcing Services,0.0,0,25,50,NA ,250 - 999,1999,"United States, India "
element61,experience & expertise - Thought-leading Analytics ,0.0,0,80,5,$100 - $149/hr ,50 - 249,2007,Belgium 
Tectoro Consulting Pvt Ltd,Capital Markets Technology Solutions,0.0,0,20,50,$25 - $49/hr ,50 - 249,2015,"India, Singapore "
Rock Your Data,Delivering Cloud Analytics that Rocks Your Data,0.0,0,70,10,$150 - $199/hr ,10 - 49,2017,Canada 
CodeRiders,We desire. Together we achieve!,0.0,0,15,50,$25 - $49/hr ,10 - 49,2013,Armenia 
Notionmind,Software. Strategy. Managed Services.,0.0,0,15,50,$50 - $99/hr ,10 - 49,2019,India 
OptimusFox,Best Blockchain Development Company in USA,0.0,0,15,50,$50 - $99/hr ,50 - 249,2018,United States  
QAT Global,Together We Can Accomplish Anything - US - BR- CR,0.0,0,10,50,$50 - $99/hr ,50 - 249,1995,"United States, Brazil "
Youtech,Bold people. Big ideas. Real solutions.,0.0,0,10,50,$200 - $300/hr ,50 - 249,2012,United States 
Web Daytona,Digital Marketing Agency,0.0,0,10,50,< $25/hr ,10 - 49,2009,United States 
Right Information,Perfect match when standard software is not enough,0.0,0,10,50,$50 - $99/hr ,10 - 49,2001,Poland 
ISHIR Secure,"ISHIR Secure, a managed security services provider",0.0,0,20,40,NA ,50 - 249,1999,United States 
"BrookeWealth Global, LLC",Business Consultants. Creating Value. ,0.0,0,50,15,$100 - $149/hr ,2 - 9,2019,United States 
Easy Code LTD,bespoke software solutions,0.0,0,5,50,$100 - $149/hr ,2 - 9,2016,United Kingdom 
Zeal Tech,ZealTech.io / Software Development Experts ,0.0,0,15,40,$100 - $149/hr ,50 - 249,2011,United States 
